acctid,Account,Name,CUSIP,Shares,Market Value,TickerAFL-AGC-3,WELFARE PLAN-FIXED, MICROSOFT CORP CALLABLE DTD 05/02/2013 2.375% 05/01/2023-2023 ,594918AT1,65000,65169,AFL-AGC-3,WELFARE PLAN-FIXED, MISSISSIPPI ST SER D FED TAXABLE SINK/M-W CALL G/O 10/29/09 5.539% 10/01/2029 ,6055805Q8,45000,54060,AFL-AGC-3,WELFARE PLAN-FIXED, MISSISSIPPI ST REF SER D FED & ST TXBL M-W CALL G/O 02/18/15 2.195% 10/01/2021 ,605581EU7,75000,75350,AFL-AGC-3,WELFARE PLAN-FIXED, MUNICIPAL ELEC AUTH GA SUB-PROJ ONE-SER A FED TAXABLE SINK/M-W CALL INSD: NATL-RE FGIC REV BD 01/19/05 5.07% 01/01/2019-2005 ,626207MV3,15000,15339,AFL-AGC-3,WELFARE PLAN-FIXED, N Y CITY NY TRANS FIN AUTH SUB-SUBSER F-1 FED TAXABLE M-W CALL REV BD 4/21/16 2.61% 02/01/2025-2016 ,64971WF70,30000,29691,AFL-AGC-3,WELFARE PLAN-FIXED, N Y CITY NY TRANS FIN AUTH SUB-SER E-3 FED TAXABLE CALL/M-W CALL REV BD 2/26/16 2.92% 02/01/2027-2026 ,64971WZV5,85000,84029,AFL-AGC-3,WELFARE PLAN-FIXED, NORFOLK VA BUILD AMER BDS DIR PMT SER B FED TAXABLE M-W CALL G/O 1/21/10 4.4% 03/01/2018-2010 ,655867HY8,5000,5057,AFL-AGC-3,WELFARE PLAN-FIXED, NORTH CAROLINA MUN PWR AGY #1 CATAWBA ELEC SER B FED TAXABLE M-W CALL REV BD 10/08/09 5.482% 01/01/2021-2009 ,658203L36,20000,21997,AFL-AGC-3,WELFARE PLAN-FIXED, OREGON CMNTY COLLEGE DIST FED TAXABLE ONLY-B-BHAC-CR GEN OBLIG NON CALLABLE INSD: BHAC-CR FGIC DTD 04/23/03 5.68% 06/30/2026 ,68583RCV2,15000,18173,AFL-AGC-3,WELFARE PLAN-FIXED, OREGON ST SCH BRDS ASSN SHORT-TM BORROWING PROG CTFS-PENSION FED TAXABLE SINK/M-W CALL INSD AMBAC SCH BD GTY G/O 6/21/05 4.668% 06/30/2020 ,686053FY0,43639.2,45746,AFL-AGC-3,WELFARE PLAN-FIXED, OREGON ST PENSION FED TXBLE SINK/M-W CALL G/O 10/31/03 5.762% 06/01/2023 ,68607LXP7,86152.33,96331,AFL-AGC-3,WELFARE PLAN-FIXED, PEPSICO INC CALLABLE DTD 07/17/2015 3.1% 07/17/2022-2022 ,713448CX4,65000,67531,AFL-AGC-3,WELFARE PLAN-FIXED, PORT SEATTLE WASH SER B1-OID FED TXBLE CALL/SINK/ M-W CALL REV BD 07/16/09 7% 05/01/2036-2019 ,735389MT2,55000,59539,AFL-AGC-3,WELFARE PLAN-FIXED, SUNTRUST BANK ATLANTA SER BKNT 5.45% 12/01/2017 ,86787GAC6,65000,65415,AFL-AGC-3,WELFARE PLAN-FIXED, SUNTRUST BKS INC CALLABLE DTD 12/01/2016 2.7% 01/27/2022-2021 ,867914BM4,55000,55463,AFL-AGC-3,WELFARE PLAN-FIXED, TENNESSEE ST SER C FED TAXBL M-W CALL G/O 10/26/11 3.528% 08/01/2023 ,880541QT7,35000,37331,AFL-AGC-3,WELFARE PLAN-FIXED, TEXAS ST REF-PUBLIC FIN AUTH-SER B FED TAXABLE NON CALLABLE G/O 07/08/14 2.589% 10/01/2021 ,882723PP8,30000,30593,AFL-AGC-3,WELFARE PLAN-FIXED, TEXAS ST REF-PUBLIC FIN AUTH-SER B FED TAXABLE NON CALLABLE G/O 07/08/14 2.993% 10/01/2023 ,882723PR4,40000,41270,AFL-AGC-3,WELFARE PLAN-FIXED, TEXAS ST TECH UNIV 17TH SERIES REF SER B FED TXBLE NON CALLABLE REV BD 04/09/15 2.104% 02/15/2020 ,882806EM0,60000,60220,AFL-AGC-3,WELFARE PLAN-FIXED, TOYOTA MOTOR CREDIT CORP SERIES MTN DTD 09/15/2011 3.4% 09/15/2021 ,89233P5F9,95000,99092,AFL-AGC-3,WELFARE PLAN-FIXED, UNITED STATES TREASURY DTD 11/30/2015 1.625% 11/30/2020 ,912828M98,130000,129949,AFL-AGC-3,WELFARE PLAN-FIXED, UNITED STATES TREASURY N/B DTD 04/30/2013 .625% 04/30/2018 ,912828UZ1,190000,189318,AFL-AGC-3,WELFARE PLAN-FIXED, UNIVERSITY OF ALA GEN UNIV ALA-SER B FED TAXABLE NON CALLABLE REV BD 10/30/09 4.64% 07/01/2019 ,914026FJ3,5000,5260,AFL-AGC-3,WELFARE PLAN-FIXED, UNIV OF NORTH CAROLINA NC AT CHAPEL HILL-REF-SER C FED TAXABLE M-W CALL REV BD 3/01/16 2.679% 12/01/2027-2016 ,914713N81,45000,44748,AFL-AGC-3,WELFARE PLAN-FIXED, UNIV OF PITTSBURGH PA HGR EDU REF-UNIV OF PITT-SER A FED TXBLE M-W CALL REV BD 01/17/17 2.732% 09/15/2023 ,914805EU6,45000,45780,AFL-AGC-3,WELFARE PLAN-FIXED, UNIV OF PITTSBURGH PA HGR EDU REF-UNIV OF PITTSBURGH-SER A FED TAXABLE M-W CALL REV BD 1/17/17 2.877% 09/15/2024-2017 ,914805EV4,30000,30631,AFL-AGC-3,WELFARE PLAN-FIXED, UTAH ST BUILD AMER BDS-SER B DIR PMT FED TAXABLE SINK/M-W CALL G/O 9/30/10 3.539% 07/01/2025-2010 ,917542QV7,70000,74475,AFL-AGC-3,WELFARE PLAN-FIXED, VERIZON COMMUNICATIONS DTD 09/18/2013 5.15% 09/15/2023 ,92343VBR4,85000,95403,AFL-AGC-3,WELFARE PLAN-FIXED, VA ST CLG BLDG AUTH EDUCTNL FACS BUILD AMER BDS DIR PMT FED TAXABLE M-W CALL REV BD 11/18/10 5% 09/01/2025-2010 ,927781VV3,10000,11584,AFL-AGC-3,WELFARE PLAN-FIXED, VIRGINIA ELEC & PWR CO CALLABLE DTD 01/12/2012 2.95% 01/15/2022-2021 ,927804FK5,70000,71476,AFL-AGC-3,WELFARE PLAN-FIXED, VIRGINIA ST HSG DEV AUTH RENTAL HSG-SER C FED TAXABLE SINKABLE REV BD 03/30/2009 6.07% 08/01/2018 ,92812QVS3,25000,25631,AFL-AGC-3,WELFARE PLAN-FIXED, VIRGINIA ST HSG DEV AUTH RENTAL HSG-FED TAXABLE-SER D REV BOND NON CALLABLE SINKABLE DTD 03/30/09 6.07% 11/01/2018 ,92812QWH6,45000,46590,AFL-AGC-3,WELFARE PLAN-FIXED, WAL MART STORES INC DTD 10/25/2010 3.25% 10/25/2020 ,931142CZ4,45000,46913,AFL-AGC-3,WELFARE PLAN-FIXED, WELLS FARGO & COMPANY SERIES: MTN DTD 09/28/2015 3.55% 09/29/2025 ,94974BGP9,70000,71675,AFL-AGC-3,WELFARE PLAN-FIXED, REGIONS TRUST CASH SWEEP ,999990484,13562.16,13562,AFL-AGC-4,WELFARE PLAN-EQUITY, AGCO CORP ,1084102,408,29980,AGCOAFL-AGC-4,WELFARE PLAN-EQUITY, AETNA INC ,00817Y108,348,54740,AETAFL-AGC-4,WELFARE PLAN-EQUITY, AIR PRODS & CHEMS INC ,9158106,71,10745,APDAFL-AGC-4,WELFARE PLAN-EQUITY, ALASKA AIR GROUP INC ,11659109,363,27541,ALKAFL-AGC-4,WELFARE PLAN-EQUITY, ALBEMARLE CORP ,12653101,79,10453,ALBAFL-AGC-4,WELFARE PLAN-EQUITY, AMEREN CORP ,23608102,299,17450,AEEAFL-AGC-4,WELFARE PLAN-EQUITY, AMERICAN ELECTRIC POWER CO ,25537101,229,16145,AEPAFL-AGC-4,WELFARE PLAN-EQUITY, AMERICAN INTL GROUP INC ,26874784,672,40972,AIGAFL-AGC-4,WELFARE PLAN-EQUITY, AMERISOURCEBERGEN CORP ,3.07E+108,649,52563,ABCAFL-AGC-4,WELFARE PLAN-EQUITY, AMERIPRISE FINANCIAL INC ,03076C106,312,46098,AMPAFL-AGC-4,WELFARE PLAN-EQUITY, AMGEN INC ,31162100,288,53412,AMGNAFL-AGC-4,WELFARE PLAN-EQUITY, AMPHENOL CORP CL A ,32095101,845,69527,APHAFL-AGC-4,WELFARE PLAN-EQUITY, ANTHEM INC ,36752103,308,58452,ANTMAFL-AGC-4,WELFARE PLAN-EQUITY, APPLE INC ,37833100,416,63764,AAPLAFL-AGC-4,WELFARE PLAN-EQUITY, ARCHER DANIELS MIDLAND CO ,39483102,257,10987,ADMAFL-AGC-4,WELFARE PLAN-EQUITY, AUTOLIV INC ,52800109,216,26661,ALVAFL-AGC-4,WELFARE PLAN-EQUITY, BP PLC SPONSORED ADR ONE ADR REPRS 6 ORDINARY SHS ,55622104,473,18173,BPAFL-AGC-4,WELFARE PLAN-EQUITY, BALL CORP ,58498106,253,10479,BLLAFL-AGC-4,WELFARE PLAN-EQUITY, BANK OF AMERICA CORP ,60505104,1757,44716,BACAFL-AGC-4,WELFARE PLAN-EQUITY, BEST BUY INC ,86516101,755,42907,BBYAFL-AGC-4,WELFARE PLAN-EQUITY, BIOGEN INC ,09062X103,177,54870,BIIBAFL-AGC-4,WELFARE PLAN-EQUITY, BOEING CO ,97023105,297,75518,BAAFL-AGC-4,WELFARE PLAN-EQUITY, CAPITAL ONE FINL CORP ,14040H105,508,42733,COFAFL-AGC-4,WELFARE PLAN-EQUITY, CARLISLE CORP ,142339100,270,27140,CSLAFL-AGC-4,WELFARE PLAN-EQUITY, CARNIVAL CORP ,143658300,684,44029,CCLAFL-AGC-4,WELFARE PLAN-EQUITY, CELANESE CORP SER A ,150870103,115,11999,CEAFL-AGC-4,WELFARE PLAN-EQUITY, CENTENE CORP ,15135B101,605,57983,CNCAFL-AGC-4,WELFARE PLAN-EQUITY, CENTERPOINT ENERGY INC ,15189T107,588,17140,CNPAFL-AGC-4,WELFARE PLAN-EQUITY, CHEVRON CORP ,166764100,163,19172,CVXAFL-AGC-4,WELFARE PLAN-EQUITY, CITIGROUP INC ,172967424,659,47876,CAFL-AGC-4,WELFARE PLAN-EQUITY, COMCAST CORP CL A ,20030N101,1095,41413,CMCSAAFL-AGC-4,WELFARE PLAN-EQUITY, CONOCOPHILLIPS ,20825C104,382,19100,COPAFL-AGC-4,WELFARE PLAN-EQUITY, CROWN HOLDINGS INC ,228368106,180,10834,CCKAFL-AGC-4,WELFARE PLAN-EQUITY, CUMMINS INC ,231021106,158,26596,CMIAFL-AGC-4,WELFARE PLAN-EQUITY, D R HORTON INC ,23331A109,1230,47945,DHIAFL-AGC-4,WELFARE PLAN-EQUITY, DANAHER CORP DEL ,235851102,607,51619,DHRAFL-AGC-4,WELFARE PLAN-EQUITY, DELTA AIR LINES INC ,247361702,570,27537,DALAFL-AGC-4,WELFARE PLAN-EQUITY, DISCOVER FINANCIAL SVS ,254709108,677,43572,DFSAFL-AGC-4,WELFARE PLAN-EQUITY, DOVER CORP ,260003108,287,26263,DOVAFL-AGC-4,WELFARE PLAN-EQUITY, DR PEPPER SNAPPLE GROUP INC ,2.61E+113,571,50454,DPSAFL-AGC-4,WELFARE PLAN-EQUITY, ENI S P A EACH ADR REPRS 10 ORD SHS ,26874R108,516,16951,EAFL-AGC-4,WELFARE PLAN-EQUITY, EASTMAN CHEMICAL CO ,277432100,131,11785,EMNAFL-AGC-4,WELFARE PLAN-EQUITY, EDISON INTERNATIONAL ,281020107,207,16057,EIXAFL-AGC-4,WELFARE PLAN-EQUITY, ELECTRONIC ARTS ,285512109,399,46527,EAAFL-AGC-4,WELFARE PLAN-EQUITY, EMERSON ELECTRIC CO ,291011104,415,26087,EMRAFL-AGC-4,WELFARE PLAN-EQUITY, ENTERGY CORP ,29364G103,202,15421,ETRAFL-AGC-4,WELFARE PLAN-EQUITY, EVERSOURCE ENERGY ,30040W108,260,15748,ESAFL-AGC-4,WELFARE PLAN-EQUITY, EXELON CORP ,30161N101,456,17054,EXCAFL-AGC-4,WELFARE PLAN-EQUITY, EXPRESS SCRIPTS HOLDING CO ,30219G108,853,53799,ESRXAFL-AGC-4,WELFARE PLAN-EQUITY, EXXON MOBIL CORP ,30231G102,214,17589,XOMAFL-AGC-4,WELFARE PLAN-EQUITY, FISERV INC ,337738108,569,72951,FISVAFL-AGC-4,WELFARE PLAN-EQUITY, FIRSTENERGY CORP ,337932107,525,15787,FEAFL-AGC-4,WELFARE PLAN-EQUITY, FRANKLIN RESOURCES ,354613101,1011,45040,BENAFL-AGC-4,WELFARE PLAN-EQUITY, GENERAL DYNAMICS CORP ,369550108,359,73606,GDAFL-AGC-4,WELFARE PLAN-EQUITY, GENTEX CORP ,371901109,1370,27167,GNTXAFL-AGC-4,WELFARE PLAN-EQUITY, GILEAD SCIENCES INC ,375558103,715,57851,GILDAFL-AGC-4,WELFARE PLAN-EQUITY, GLOBAL PMTS INC ,37940X102,708,66510,GPNAFL-AGC-4,WELFARE PLAN-EQUITY, GOLDMAN SACHS GROUP INC ,38141G104,179,42149,GSAFL-AGC-4,WELFARE PLAN-EQUITY, HARTFORD FINL SVCS GROUP INC ,416515104,811,44702,HIGAFL-AGC-4,WELFARE PLAN-EQUITY, HASBRO INC ,418056107,427,41423,HASAFL-AGC-4,WELFARE PLAN-EQUITY, HESS CORPORATION ,42809H107,446,20757,HESAFL-AGC-4,WELFARE PLAN-EQUITY, HOLOGIC INC ,436440101,1360,49844,HOLXAFL-AGC-4,WELFARE PLAN-EQUITY, HOME DEPOT INC ,437076102,298,48383,HDAFL-AGC-4,WELFARE PLAN-EQUITY, HUNTSMAN CORP ,447011107,385,10534,HUNAFL-AGC-4,WELFARE PLAN-EQUITY, INGREDION INC ,457187102,93,11234,INGRAFL-AGC-4,WELFARE PLAN-EQUITY, INTEL CORP ,458140100,1926,72861,INTCAFL-AGC-4,WELFARE PLAN-EQUITY, INTERNATIONAL PAPER CO ,460146103,197,11203,IPAFL-AGC-4,WELFARE PLAN-EQUITY, J P MORGAN CHASE & CO ,46625H100,466,44447,JPMAFL-AGC-4,WELFARE PLAN-EQUITY, JACOBS ENGR GROUP DEL ,469814107,525,30539,JECAFL-AGC-4,WELFARE PLAN-EQUITY, JOHNSON & JOHNSON ,478160104,395,51141,JNJAFL-AGC-4,WELFARE PLAN-EQUITY, L-3 COMMUNICATIONS CORP ,502413107,403,75716,LLLAFL-AGC-4,WELFARE PLAN-EQUITY, LAM RESEARCH CORP ,512807108,411,74728,LRCXAFL-AGC-4,WELFARE PLAN-EQUITY, LEAR CORP ,521865204,159,27649,LEAAFL-AGC-4,WELFARE PLAN-EQUITY, LINCOLN NATIONAL CORP ,534187109,589,43191,LNCAFL-AGC-4,WELFARE PLAN-EQUITY, LOCKHEED MARTIN CORP ,539830109,219,67699,LMTAFL-AGC-4,WELFARE PLAN-EQUITY, MANPOWER GROUP ,56418H100,398,47732,MANAFL-AGC-4,WELFARE PLAN-EQUITY, MARATHON OIL CORP ,565849106,1565,21174,MROAFL-AGC-4,WELFARE PLAN-EQUITY, MCDONALDS CORP ,580135101,292,45987,MCDAFL-AGC-4,WELFARE PLAN-EQUITY, MCKESSON CORP ,58155Q103,324,49805,MCKAFL-AGC-4,WELFARE PLAN-EQUITY, MERCK & CO. INC. NEW ,58933Y105,786,50532,MRKAFL-AGC-4,WELFARE PLAN-EQUITY, METLIFE INC ,59156R108,794,40748,METAFL-AGC-4,WELFARE PLAN-EQUITY, MOHAWK INDS INC ,608190104,184,45647,MHKAFL-AGC-4,WELFARE PLAN-EQUITY, MORGAN STANLEY GROUP INC ,617446448,977,47043,MSAFL-AGC-4,WELFARE PLAN-EQUITY, MOSAIC CO - WI ,61945C103,547,11651,MOSAFL-AGC-4,WELFARE PLAN-EQUITY, MOTOROLA SOLUTIONS INC SOLUTIONS INC. ,620076307,760,63604,MSIAFL-AGC-4,WELFARE PLAN-EQUITY, MURPHY OIL CORP ,626717102,648,17490,MURAFL-AGC-4,WELFARE PLAN-EQUITY, NRG ENERGY INC ,629377508,654,16285,NRGAFL-AGC-4,WELFARE PLAN-EQUITY, NATIONAL OILWELL VARCO INC ,637071101,585,20785,NOVAFL-AGC-4,WELFARE PLAN-EQUITY, NORTHROP GRUMMAN CORP ,666807102,248,70586,NOCAFL-AGC-4,WELFARE PLAN-EQUITY, OGE ENERGY CORP ,670837103,448,16209,OGEAFL-AGC-4,WELFARE PLAN-EQUITY, ORACLE CORPORATION ,68389X105,1433,68899,ORCLAFL-AGC-4,WELFARE PLAN-EQUITY, OWENS ILL INC COM NEW ,690768403,463,11677,OIAFL-AGC-4,WELFARE PLAN-EQUITY, PVH CORP ,693656100,325,40794,PVHAFL-AGC-4,WELFARE PLAN-EQUITY, PACKAGING CORP OF AMERICA ,695156109,90,10405,PKGAFL-AGC-4,WELFARE PLAN-EQUITY, PARKER HANNIFIN CORP ,701094104,150,26373,PHAFL-AGC-4,WELFARE PLAN-EQUITY, PITNEY BOWES INC ,724479100,2034,28374,PBIAFL-AGC-4,WELFARE PLAN-EQUITY, PRINCIPAL FINANCIAL GROUP ,74251V102,640,40960,PFGAFL-AGC-4,WELFARE PLAN-EQUITY, PRUDENTIAL FINANCIAL INC ,744320102,376,39856,PRUAFL-AGC-4,WELFARE PLAN-EQUITY, PUBLIC SVC ENTERPRISE GROUP INC ,744573106,364,16773,PEGAFL-AGC-4,WELFARE PLAN-EQUITY, PULTE GROUP INC. ,745867101,1856,50056,PHMAFL-AGC-4,WELFARE PLAN-EQUITY, REGIONS FINANCIAL CORP ,7591EP100,2813,42308,RFAFL-AGC-4,WELFARE PLAN-EQUITY, RELIANCE STEEL & ALUMINUM ,759509102,147,11210,RSAFL-AGC-4,WELFARE PLAN-EQUITY, ROYAL DUTCH SHELL PLC-ADR ,780259206,317,19137,RDSAAFL-AGC-4,WELFARE PLAN-EQUITY, S&P GLOBAL INC ,78409V104,270,41993,SPGIAFL-AGC-4,WELFARE PLAN-EQUITY, SCANA CORP NEW ,80589M102,271,13818,SCGAFL-AGC-4,WELFARE PLAN-EQUITY, SOUTHWESTERN ENERGY CO ,845467109,3227,19814,SWNAFL-AGC-4,WELFARE PLAN-EQUITY, SPIRIT AEROSYSTEMS HOLDING-CL A ,848574109,892,69219,SPRAFL-AGC-4,WELFARE PLAN-EQUITY, STANLEY BLACK & DECKER INC. ,854502101,276,41268,SWKAFL-AGC-4,WELFARE PLAN-EQUITY, STERICYCLE INC ,858912108,792,56802,SRCLAFL-AGC-4,WELFARE PLAN-EQUITY, SUNTRUST BKS INC ,867914103,717,42518,STIAFL-AGC-4,WELFARE PLAN-EQUITY, T-MOBILE US INC ,872590104,276,17090,TMUSAFL-AGC-4,WELFARE PLAN-EQUITY, TAKE-TWO INTERACTIVE SOFTWARE ,874054109,408,41163,TTWOAFL-AGC-4,WELFARE PLAN-EQUITY, TEXAS INSTRUMENTS INC ,882508104,868,77816,TXNAFL-AGC-4,WELFARE PLAN-EQUITY, 3M CO ,88579Y101,137,28708,MMMAFL-AGC-4,WELFARE PLAN-EQUITY, TOLL BROTHERS INC ,889478103,1208,49504,TOLAFL-AGC-4,WELFARE PLAN-EQUITY, TOTAL S A SPONSORED ADR ONE ADR RPRS 0.5 ORD SH ,8.92E+113,322,17201,TOTAFL-AGC-4,WELFARE PLAN-EQUITY, TYSON FOODS ,902494103,858,56156,TSNAFL-AGC-4,WELFARE PLAN-EQUITY, UNITED CONTINENTAL HOLDINGS INC ,910047109,413,25259,UALAFL-AGC-4,WELFARE PLAN-EQUITY, UNITED RENTALS INC ,911363109,366,50497,URIAFL-AGC-4,WELFARE PLAN-EQUITY, UNITED HEALTH GROUP INC ,91324P102,284,55692,UNHAFL-AGC-4,WELFARE PLAN-EQUITY, UNUM GROUP ,91529Y106,876,44755,UNMAFL-AGC-4,WELFARE PLAN-EQUITY, VERIZON COMMUNICATIONS ,92343V104,347,17145,VZAFL-AGC-4,WELFARE PLAN-EQUITY, WESTERN UNION CO ,959802109,2632,50166,WUAFL-AGC-4,WELFARE PLAN-EQUITY, WEST LAKE CHEMICAL CORP ,960413102,136,11363,WLKAFL-AGC-4,WELFARE PLAN-EQUITY, XCEL ENERGY INC ,98389B100,343,16248,XELAFL-AGC-4,WELFARE PLAN-EQUITY, REGIONS TRUST CASH SWEEP ,999990484,83196.26,83196,AFL-AGC-4,WELFARE PLAN-EQUITY, DELPHI AUTOMOTIVE PLC ,G27823106,262,25608,DLPHAFL-AGC-4,WELFARE PLAN-EQUITY, WEATHERFORD INTERNATIONAL PL ,G48833100,4060,18311,WFTAFL-AGC-4,WELFARE PLAN-EQUITY, NABORS INDUSTRIES LTD ,G6359F103,2793,22707,NBRAFL-AGC-4,WELFARE PLAN-EQUITY, TE CONNECTIVITY LTD SEDOL #B62B7C3 ISIN #CH0102993182 ,H84989104,843,69657,TELAFL-AGC-4,WELFARE PLAN-EQUITY, TRANSOCEAN LTD ,H8817H100,1972,20883,RIGAFL-AGC-4,WELFARE PLAN-EQUITY, LYONDELLBASELL INDUSTRIES - CL A SEDOL #B3SPXZ3 ISIN #NL0009434992 ,N53745100,111,11076,LYBAFL-AGC-4,WELFARE PLAN-EQUITY, ROYAL CARIBBEAN CRUISES LTD ,V7780T103,397,46929,RCL,,,,,4930407,